{
  "note": "A056 exact full_source и live DOM. Личная история, не руководство по восхождению. Никаких смысловых дополнений: только очевидная пунктуация/опечатки и замена старой ссылки штатным ботом. Все 11 исходных фотографий сжаты без кадрирования и размещаются на собственном сервере; card01 contain, hero off. Видео сохранено голосовым диспетчером без изменений, в статье допустимая ссылка на оригинальный ролик: большой файл не включается в Git. Авторские возрасты, высоты, дистанции, результаты, шутки и историческая дата сохранены.",
  "work_profile": "develop_existing",
  "edit_mode": "targeted_edit",
  "source_basis": "full_source",
  "surface_context": "site_article",
  "delivery_platform": "website",
  "format_profile": "article",
  "source_text": "*я знаю, ты читаешь))*\n\nМоя мама — это живой пример того, что начинать — никогда не поздно! **Поздно, если над вами деревянная крышка** и земелькой присыпано, любое другое время — в самый раз чтобы пытаться, ошибаться и пробовать что-то новое! Жить, короче, ну вы поняли...\n\n## Сейчас я напомню ЕЙ и расскажу ВАМ какая у меня крутая мама!\n\n![Сергей с мамой в горах](/blog/media/11448583/01.webp)\n\n## Где-то до 2015-го\n\nОбычная домохозяйка, хоть в палату мер и весов. С тремя спиногрызами, два помладше, один — ваш покорный слуга. Бег, походы, тренировки? Нет-нет-нет! — Готовка, мытьё посуды и уборка. А из походов только те, что за помидорами на ярмарку в выходной день 😐\n\n![Верните мне мой 2004-й](/blog/media/11448583/02.webp)\n\n*Верните мне мой 2004-й*\n\nКогда я закончил учебу, то променял тренажерный зал на горные маршруты и за кружкой чая иногда рассказывал как это всё весело. А однажды услышал фразу — **\"я тоже хочу\"!** Больше её жизнь уже не была прежней.\n\n![г. Мамдзышха](/blog/media/11448583/03.webp)\n\n*г. Мамдзышха*\n\n## Сначала были пешие походы\n\nДома вокруг Геленджика, в Крыму, в Абхазии. До сих пор помню, как на тетрадном листке писал ей инструкцию, как пройти на Ай-Петри. Где куда свернуть в лесу и какую развилку выбрать, потому что карта в телефоне — это пока было слишком сложно 😁\n\n![г. Ильяс-кая](/blog/media/11448583/04.webp)\n\n*г. Ильяс-кая*\n\n**Потом мама смекнула**, что на все хотелки ей не хватает физухи и начала бегать! Бегать, впервые в свои 49 лет!! С нуля!! Это как в 50, только на 1 поменьше. Часы, кроссовки, нагрудный пульсометр, тренировки в страве!\n\n## А в 19-м и 20-м я поднимался на Эльбрус\n\nПоказывал фото, рассказывал за кружкой чая как это всё весело... уже догадываетесь, что было потом?\n\n![Буквально))](/blog/media/11448583/05.webp)\n\n*Буквально))*\n\nОна САМА ДОШЛА ДО СЕДЛОВИНЫ НА ВЫСОТЕ **5300** МЕТРОВ!!!! Без меня, без гидов, без подъемников, зато в кошках с алиэкспресса, с трекинговыми палками и термосом чая. До приютов тоже пешком топала, чтобы акклиматизироваться.\n\nЯ вот сейчас пишу и сам думаю... ашалеть))\n\n![г. Чегет](/blog/media/11448583/06.webp)\n\n*г. Чегет*\n\nДальше она начала осваивать плавание кролем, а почему бы и нет? Езду на велосипеде и черт его помнит, что ещё. Году в 17-м поехала заграницу, впервые я хз за сколько лет, может вообще впервые, не помню. Закончилось всё тем, что по приезду уже ОНА рассказывала МНЕ за кружкой чая о своем опыте АВТОСТОПА по Грузии и Армении.\n\n![За спиной Арарат пару сотен км автостопа](/blog/media/11448583/07.webp)\n\n*За спиной Арарат пару сотен км автостопа*\n\nВ 19-м ходили вместе в пятидневный поход — знаменитый 30-й маршрут «Через горы к морю». Мама первый раз ночевала в палатке, разок плюхнулась лицом в тропинку, а на следующий день немного потерялась при спуске с Фишта, ну бывает 😅\n\n![Мама на горном маршруте](/blog/media/11448583/08.webp)\n\n**В 22-м пробежала ГОРНЫЙ марафон** в 32км за 6 часов 30 минут! А в 23-м всего лишь полумарафон, но уже плоский, по трассе Сочи-Автодрома со временем 2:45 на 21км. Медленно? Вы думаете её это волнует? 😁\n\n![Мама на забегах: 32 км и 21 км](/blog/media/11448583/09.webp)\n\nПоследний раз виделись в прошлом году в районе Казбека, когда она приезжала в гости — естественно мы поперлись в горы, вот видео с того маршрута:\n\n[Посмотреть видео с маршрута](https://cs14.pikabu.ru/video/2024/05/25/1716585458245585147_0acdc621_720x1280.mp4)\n\n![Мама на тропе в районе Казбека](/blog/media/11448583/10.webp)\n\nЗвонил ей как-то месяц назад, говорит — ой, а ты на долго, я тут на Бештау собираюсь (Прятигорск), не могу говорить... ¯\\_(ツ)_/¯\n\n## Сегодня маме исполняется 20!\n\n*(с хвостиком)*\n\nПо другому сказать — язык не повернется. Конечно, я пожелаю здоровья и всего такого, но это тот неловкий случай, когда трудно пожелать что-то ещё, кроме как продолжать в том же духе!\n\n*\\*Это пост не о том, что счастье в горах или всяких забегах-марафонах, дело в другом*\n\nНекоторые люди умирают в 25, просто мы их не хороним до 70-ти.\n\nДумайте.\n\n![Сергей с мамой на фоне Казбека](/blog/media/11448583/11.webp)\n\n[телеграм](https://t.me/+peKrRrqG_Gs4YzEy)\n",
  "editable_scope": [
    "в самый раз чтобы",
    "расскажу ВАМ какая",
    "рассказывал как",
    "не хватает физухи и начала",
    "за кружкой чая как",
    "поехала заграницу",
    "может вообще впервые",
    "32км",
    "21км",
    "Вы думаете её",
    "естественно мы",
    "на долго",
    "Прятигорск",
    "По другому сказать",
    "[телеграм](https://t.me/+peKrRrqG_Gs4YzEy)"
  ],
  "allowed_removals": [],
  "preservation_anchors": [
    "ашалеть))",
    "**5300**",
    "49 лет!!",
    "6 часов 30 минут",
    "2:45",
    "Сегодня маме исполняется 20!",
    "Думайте."
  ],
  "required_facts": [],
  "forbidden_claims": []
}
