{
  "note": "Полные A031/A161/A281 сравнены, расширенная поздняя авторская A281 VC912323 выбрана без склейки с предками. Сохранены три картинки, подпись, четыре ссылки PMID, две цитаты и два выделения; шутка пытают-наблюдают plaintext как в этой версии. Удалён только навигационный список VC; нативный CTA сохранён с маршрутом действующего бота по команде владельца. Все факты/числа/универсальные утверждения неизменны; научные риски в owner-review. КороткийTelegramанонс223 не добавляется в статью и не делает её Telegram-origin.",
  "work_profile": "develop_existing",
  "edit_mode": "targeted_edit",
  "source_basis": "full_source",
  "surface_context": "site_article",
  "delivery_platform": "website",
  "format_profile": "article",
  "source_text": "Привет. По крайней мере, в том виде, как вы это представляете. Короче, вот эта картинка ниже, а точнее, зеленая полоска на ней, вводит нас всех в заблуждение. И это отличный пример того, когда по форме все верно, но практического толку в этом нет! Давайте объясню!\n\n![Диаграмма пульсовых зон с выделенной зоной жиросжигания](/blog/media/10797468/01.webp)\n\nДля тех, кто в танке, утверждение, которое я сейчас оспариваю, звучит так:\n\n> Для эффективного похудения необходимо тренироваться с определенной интенсивностью (пульсом), чтобы основным топливом для работы являлся жир.\n\nДействительно, при определенной интенсивности наше тело работает преимущественно на жирах, но к эффективному похудению это не имеет никакого отношения.\n\n**Основной тезис поста звучит так, а дальше поясню подробней:**\n\n> Если вы совершили одинаковый объем работы, то окисление жиров в среднем по итогу 24-х часов будет одинаковым, независимо от протокола, по которому вы тренировались.\n\nДля начала, расход калорий от тренировочного эффекта делится на две части — во время тренировки и после неё, пресловутый \"разгон метаболизма\". Ребята из зала обычно считают, что второе свойственно только им, но это распространяется и на кардио и на любую физическую активность.\n\n## А что значит одинаковый объем работы?\n\n![Интенсивность разная, а объем одинаковый](/blog/media/10797468/02.webp)\n\nИнтенсивность разная, а объем одинаковый\n\nЕсли утрировать, то пробежав 5км на максимальном темпе, пробежав их же в среднем темпе или вообще медленно — расход калорий будет одинаковый, отличаться будет только затраченное время и относительное усилие (восприятие усилия). Небольшая разница в ккал все же будет, но только из отличий в биомеханике движения (около 3-5%), а не из-за интенсивности. Вот [исследование](https://pubmed.ncbi.nlm.nih.gov/16260982/) - бег 8000 метров, сравнивали скорости 70% от анаэроба и 95%.\n\nС некоторыми допущениями это можно применить и к силовым упражнениям используя общий тоннаж (для каждого упражнения).\n\n## Жировой обмен\n\nРасход калорий — это сжигание субстрата из разных веществ в разных пропорциях, один из них - жир. А жиросжигание это именно сколько в этом субстрате жира.\n\nЕсли на тренировке вы получали энергию из жировых запасов (тренируясь в жиросжигающей зоне), тогда в период восстановления, организм будет использовать более активно гликоген, а жиры жечь НЕ будет. И наоборот, если вы гнали на диком пульсе и работали на тренировке только на гликогене, то после её окончания организм будет тратить преимущественно жиры, даже лежа на кровати. К исходу 24 часов итоговой разницей при двух сценариях можно будет пренебречь.\n\nНеважно заплатите ли вы с кредитки, у которой льготный период 45 дней, или прямо сейчас наличными. Через 45 дней у вас этих денег все равно не будет. Так же и с жиром/гликогеном.\n\nИсследования по теме: [один](https://pubmed.ncbi.nlm.nih.gov/30325710/), [два](https://pubmed.ncbi.nlm.nih.gov/19833807/), [три](https://pubmed.ncbi.nlm.nih.gov/25429252/). Второе вообще с использованием метаболической камеры. Это когда человека закрывают на сутки+ вот в такой комнатушке и пытают-наблюдают.\n\n![Метаболическая камера для исследования расхода энергии](/blog/media/10797468/03.webp)\n\n**Предвижу возражение** \"мало человеков\". Во-первых, количество испытуемых от части компенсируется качеством контроля среды. Во-вторых, исследования в из которых растут ноги жиросжигающей зоны имеют столько же участников и это никого не смущает.\n\n## Но пульсовые зоны все равно важны!\n\nДля похудения: банальная математика — с низкой интенсивностью утомляемость ниже и выполнить бóльший объем работы может быть легче. А значит, и потратить больше калорий, а как я уже 100 раз писал — это единственное, что решает по жиросжиганию и вообще сжиганию. При этом сделать тот же объем интервалами всегда тяжелее. Да и в целом новичкам проводить кардио на высоком пульсе как минимум не полезно.\n\nДля физического развития: тут уже не конкретно зона жиросжигания важна, а все пульсовые зоны разом. Ведь используя весь спектр нагрузок в нужных пропорциях, можно добиться шикарных результатов намного быстрее, чем просто бегая туда-сюда.\n\nНа этом у меня все. Спасибо за внимание, передавайте привет тренерам, которые советуют \"особенные\" жиросжигающие зоны для похудения.\n\nЕщё мои посты на VC:\n[Что вы НЕ понимаете о формировании привычек⁠⁠](https://vc.ru/flood/895597-chto-vy-ne-ponimaete-o-formirovanii-privychek)\n[Чем отличаются «‎плохие»‎, «‎хорошие»‎ и «‎быстрые»‎ завтраки](https://vc.ru/flood/801045-chem-otlichayutsya-plohie-horoshie-i-bystrye-zavtraki)\n[Перекусы худеть мешают или помогают?](https://vc.ru/flood/744943-perekusy-hudet-meshayut-ili-pomogayut)\n[8 советов тем, кто хочет начать бегать](https://vc.ru/flood/752179-8-sovetov-tem-kto-hochet-nachat-begat)\n[Мы все едим фрукты (не) правильно!⁠⁠](https://vc.ru/flood/793473-my-vse-edim-frukty-ne-pravilno)\n\nТелеграм: [Sergey Vorontsov | FitnessTalks](https://t.me/+xxdEhfoM9zFjNTIy), пишу о питании похудении, тренировках и адекватном отношении к здоровому образу жизни.\n",
  "editable_scope": [
    "Для начала, расход",
    "и на кардио и на любую",
    "5км",
    "силовым упражнениям используя",
    "один из них - жир",
    "А жиросжигание это",
    "в период восстановления, организм",
    "Неважно заплатите ли",
    "от части компенсируется",
    "исследования в из которых",
    "жиросжигающей зоны имеют",
    "t.me/+xxdEhfoM9zFjNTIy",
    "о питании похудении",
    "Ещё мои посты на VC:\n[Что вы НЕ понимаете о формировании привычек⁠⁠](https://vc.ru/flood/895597-chto-vy-ne-ponimaete-o-formirovanii-privychek)\n[Чем отличаются «‎плохие»‎, «‎хорошие»‎ и «‎быстрые»‎ завтраки](https://vc.ru/flood/801045-chem-otlichayutsya-plohie-horoshie-i-bystrye-zavtraki)\n[Перекусы худеть мешают или помогают?](https://vc.ru/flood/744943-perekusy-hudet-meshayut-ili-pomogayut)\n[8 советов тем, кто хочет начать бегать](https://vc.ru/flood/752179-8-sovetov-tem-kto-hochet-nachat-begat)\n[Мы все едим фрукты (не) правильно!⁠⁠](https://vc.ru/flood/793473-my-vse-edim-frukty-ne-pravilno)"
  ],
  "preservation_anchors": [
    "пытают-наблюдают",
    "70% от анаэроба и 95%",
    "около 3-5%",
    "жиры жечь НЕ будет",
    "бóльший",
    "привет тренерам"
  ],
  "required_facts": [],
  "forbidden_claims": []
}